{"city":"delhi","generated_at":"2026-07-22T22:47:50Z","window":{"start":"2025-11-08","end":"2025-11-24"},"dates":["2025-11-08","2025-11-11","2025-11-14","2025-11-19","2025-11-24"],"note":"Out-of-fold: models trained EXCLUDING the Nov-2025 window (2025-11-01 to 2025-12-01); predictions at held-out Nov-2025 dates."}